{
  "decisionRules": {
    "delegateOnlyWhenParallelismMateriallyHelps": true,
    "fallback": {
      "onExhaustion": "do-not-delegate",
      "rule": "try-fallback-route-ids-in-order",
      "silentSubstitutionForbidden": true
    },
    "tieBreakers": [
      "highest-safety-rank",
      "most-specific-match",
      "lowest-precedence-number"
    ],
    "uncertainty": {
      "rule": "choose-the-highest-safety-rank-among-plausible-routes",
      "unknownHighRiskRouteId": "ambiguous-cross-cutting-high-risk"
    }
  },
  "defaults": [
    {
      "claimStrength": "hypothesis",
      "evidenceRefs": [],
      "availabilityFallbackConfigurationIds": ["luna-medium", "luna-high", "sol-medium", "sol-high"],
      "estimand": "worker",
      "id": "mechanical-repository-work",
      "model": "gpt-6-luna",
      "precedence": 10,
      "reasoningEffort": "low",
      "selectedConfigurationId": "luna-low",
      "safetyRank": 10,
      "specificity": 60,
      "summary": "Tightly bounded, low-risk mechanical work with cheap deterministic verification",
      "taskClass": "mechanical-repository-work"
    },
    {
      "claimStrength": "hypothesis",
      "evidenceRefs": [],
      "availabilityFallbackConfigurationIds": ["luna-high", "sol-medium", "sol-high"],
      "estimand": "worker",
      "id": "bounded-mapping-and-patch",
      "model": "gpt-6-luna",
      "precedence": 20,
      "reasoningEffort": "medium",
      "selectedConfigurationId": "luna-medium",
      "safetyRank": 20,
      "specificity": 60,
      "summary": "Bounded code mapping or a small low-risk patch with an explicit contract and strong checks",
      "taskClass": "bounded-mapping-and-patch"
    },
    {
      "claimStrength": "hypothesis",
      "evidenceRefs": [],
      "availabilityFallbackConfigurationIds": ["luna-high", "sol-medium", "sol-high"],
      "estimand": "worker",
      "id": "isolated-implementation-debugging",
      "model": "gpt-6-luna",
      "precedence": 30,
      "reasoningEffort": "medium",
      "selectedConfigurationId": "luna-medium",
      "safetyRank": 30,
      "specificity": 60,
      "summary": "Isolated, well-specified implementation or repair with deterministic acceptance tests",
      "taskClass": "isolated-implementation-debugging"
    },
    {
      "claimStrength": "hypothesis",
      "evidenceRefs": [],
      "availabilityFallbackConfigurationIds": ["sol-high"],
      "estimand": "worker",
      "id": "read-heavy-exploration-synthesis",
      "model": "gpt-6.1-sol",
      "precedence": 40,
      "reasoningEffort": "medium",
      "selectedConfigurationId": "sol-medium",
      "safetyRank": 40,
      "specificity": 60,
      "summary": "Structured defect localization with exact source-bound path, line, and excerpt evidence",
      "taskClass": "read-heavy-exploration-synthesis"
    },
    {
      "claimStrength": "hypothesis",
      "evidenceRefs": [],
      "availabilityFallbackConfigurationIds": ["sol-high"],
      "estimand": "worker",
      "id": "coordination-integration",
      "model": "gpt-6.1-sol",
      "precedence": 50,
      "reasoningEffort": "medium",
      "selectedConfigurationId": "sol-medium",
      "safetyRank": 50,
      "specificity": 60,
      "summary": "Multi-file contract, producer, consumer, and acceptance-state integration",
      "taskClass": "coordination-integration"
    },
    {
      "claimStrength": "hypothesis",
      "evidenceRefs": [],
      "availabilityFallbackConfigurationIds": [],
      "estimand": "worker",
      "id": "ambiguous-cross-cutting-high-risk",
      "model": "gpt-6.1-sol",
      "precedence": 60,
      "reasoningEffort": "high",
      "selectedConfigurationId": "sol-high",
      "safetyRank": 60,
      "specificity": 60,
      "summary": "Compatibility, implementation, rollback, and acceptance-state transitions under high risk",
      "taskClass": "ambiguous-cross-cutting-high-risk"
    }
  ],
  "coordinatorDefaults": [
    {
      "claimStrength": "hypothesis",
      "configurationId": "sol-medium",
      "estimand": "live-coordinator-with-frozen-workers",
      "evidenceRefs": [],
      "id": "live-coordinator-session",
      "model": "gpt-6.1-sol",
      "reasoningEffort": "medium",
      "summary": "Session-starting hypothesis for the live coordinator while all leaf workers remain frozen to Luna high",
      "taskClass": "coordination-integration"
    }
  ],
  "configurationCostOrder": [
    "luna-low",
    "luna-medium",
    "luna-high",
    "sol-medium",
    "sol-high"
  ],
  "evidenceBundles": [],
  "guidance": {
    "appliesFrom": "gpt-6",
    "sourceUrl": "https://developers.openai.com/api/docs/guides/model-selection",
    "status": "vendor-guidance-adapted-as-hypothesis",
    "decisionPriority": ["verified-correctness", "cost-on-quality-tie", "time-on-quality-and-cost-tie"]
  },
  "fastMode": {
    "inferFromModelOrEffort": false,
    "requiredForLuna": false,
    "scope": "session",
    "spawnAgentParameter": false
  },
  "policyId": "orchestrate-routing",
  "policyVersion": "2.2.0",
  "schemaVersion": 2,
  "status": "provisional"
}
